name,funding_amount,city,country,industry,funding_stage,description,investors,startup_age,team_background,traction_indicators,valuation,round_type,language,region_category,company_website,article_keywords,url,publish_date,founder_linkedin
NAO,1000000.0,Berlin,Germany,"FinTech, co-investment platform",Seed,"NAO is a co-investment platform for private and alternative investments, aiming to liberalise investment and support people in building long-term wealth.","Jens Hilgers, BITKRAFT Ventures",2,"Serial entrepreneur Robin Binder, Philipp Nowakowski, Amel Hasanovic","Several thousand customers, average investment of €10k, active in Germany and Austria, partnerships with banks and asset managers",,Seed,English,EU,,"FinTech, co-investment platform, alternative investments, democratise access, seed financing, BITKRAFT Ventures",https://www.eu-startups.com/2025/03/fintech-startup-nao-secures-additional-capital-of-over-e1-million-for-its-co-investment-platform/,"March 18, 2025",
Walk15,5000000.0,Vilnius,Lithuania,"wellness, sustainability",Series A,Walk15 is a sustainable initiative startup focused on encouraging mobility and wellness activities through its mobile app.,"Coinvest Capital, NGL, PVVG Holding",2019,"Founder and CEO Vlada Musvydaitė-Vilčiauskė, Co-founder Vytautas Višinskis","Approaching 1 million app users globally, active in Baltic and Scandinavian countries, Germany, Romania, UK, and US; partnerships with EuroLeague, REWE Group, Ergo, Gitex Europe, GreenTech Festival, EAPM; engaged fans during UEFA EURO 2024",30000000,Series A,English,EU,,"sustainability, wellness, mobile app, international expansion, B2C, B2B, partnerships, investment",https://www.eu-startups.com/2025/03/walk15-opens-its-series-a-investment-round-as-it-reaches-a-e30-million-valuation/,"March 17, 2025",
Evera,2000000.0,Paris,France,"electric vehicle subscriptions, sustainable mobility",fundraising round,"Evera democratises access to EVs for businesses with a flexible and transparent subscription solution, offering both new and reconditioned vehicles.","Baltis – Groupe Magellim, Newfund NAEH Innopy, MCapital, AstoryaVC, Eric Ibled",2020,"Dorian Jorry (COO and Co-founder), Quentin Fabre (Co-Founder)","clients include Il Ristorante, GAN, and Thouy; proprietary technology platform for electric fleet management",,,English,EU,,"electric vehicle, EV subscriptions, sustainable mobility, fleet management, B2B, energy transition",https://www.eu-startups.com/2025/03/evera-raises-e2-million-to-accelerate-the-electrification-of-professional-fleets/,"March 17, 2025",
Monte Carlo Capital,11700000.0,Monte Carlo,Europe,"DeepTech, AI, space, IoT, HealthTech, SaaS, fintech, marketplaces",Seed,VC firm focusing on Seed-stage investments in DeepTech and transformational businesses across the US and Europe.,"Sequoia, Insight Partners, a16z, Thoma Bravo",15,"Seasoned Angel investor, led over 50 syndicates, acted as lead investor in multiple rounds up to Series B","Deployed €6.5 million across 22 portfolio companies, additional €6.7 million invested through 10 co-investments via SPVs",,Seed,English,EU,,"VC firm, Seed-stage, DeepTech, transformational businesses, hybrid investment model, SPVs, co-investments",https://www.eu-startups.com/2025/03/monte-carlo-capital-closes-e11-7-million-fund-to-back-deeptech-and-transformational-startups/,"March 17, 2025",
Dalma,20000000.0,Paris,France,"pet insurance, pet health, wellness",Series B,Dalma is a pet insurance company aiming to revolutionize pet welfare across Europe with an innovative and transparent approach.,"Breega, Northzone, Anterra Capital, Bpifrance’s Digital Venture 3 fund",2021,"Alban de Préville, Raphaël Sadaka, Harry Belinga","60k pets insured, 700% growth since Series A, profitability in France",,Series B,English,EU,https://www.dalma.co,"pet insurance, veterinary, AI, reimbursement, Europe, expansion",https://www.eu-startups.com/2025/03/in-just-two-clicks-dalma-raises-e20-million-to-expand-its-pet-insurance-offering/,"March 17, 2025",
Maxion Therapeutics,68900000.0,Cambridge,UK,"BioTech, Pharmaceuticals",Series A,Developing antibody-based KnotBody drugs for ion channel and G protein coupled receptor (GPCR) driven diseases.,"General Catalyst, British Patient Capital, Solasta Ventures, Eli Lilly and Company, LifeArc Ventures, Monograph Capital, BGF",4,"Dr John McCafferty (CTO) and Dr Aneesh Karatt-Vellatt (CSO), BioTech entrepreneurs and scientists","Preclinical development of lead KnotBody programme MAX001 for inflammatory diseases, early-stage programmes for pain and cardiovascular disease",,Series A,English,UK,,"KnotBody, ion channel, GPCR, antibody, BioTech, therapeutics, drug discovery",https://www.eu-startups.com/2025/03/maxion-therapeutics-raises-e68-million-to-advance-its-knotbody-pipeline-and-platform/,"March 17, 2025",
Adara Ventures,140000000.0,Madrid,Spain,"cybersecurity, applied AI, digital infrastructure, hardware components, digital health, space, energy transition technologies",,Madrid-based VC firm specialising in early-stage DeepTech investments.,"institutional investors, pension funds, asset managers, high-net-worth individuals, family offices",19,"Alberto Gómez and Nicolas Goulet, with extensive investment and operational experience in cybersecurity, analytics, and software","invested in over 50 pioneering companies across Europe and the U.S., achieving more than 10 notable exits",350000000,Seed,English,EU,,"DeepTech, cybersecurity, AI, digital infrastructure, hardware, digital health, space, energy transition, VC, fundraising",https://www.eu-startups.com/2025/03/adara-ventures-announces-first-close-of-e100-million-adara-ventures-iv-fund/,"March 17, 2025",
Merx,1100000.0,London,UK,"AI, conversational commerce, retail",pre-Seed,Merx is building an AI-powered conversational platform to connect brands with consumers via WhatsApp.,"VentureFriends, Ascension",2023,"Pietro Cammerini (ex-Accenture, digital commerce expert), Mohamed El Shaer (ex-Microsoft, AI and software development), serial entrepreneurs","Handling high volumes of interactions, enabling thousands of purchases for customers",,Pre-Seed,English,UK,,"AI, WhatsApp, conversational commerce, digital marketing, retail",https://www.eu-startups.com/2025/03/ai-startup-merx-raises-e1-1-million-to-connect-brands-with-consumers-via-whatsapp/,"March 13, 2025",
Tremau,3000000.0,Paris,France,"Trust & Safety, Content Moderation",,Tremau is a Trust & Safety startup that develops an AI-powered content moderation platform called Nima to help online platforms enhance their moderation processes and comply with regulations.,"Auriga Cyber Ventures, G+D Ventures",2021,INSEAD & MIT alumni,"Reached profitability in 2024, 30+ strong international team, clients in over a dozen countries including Bluesky, Ko-Fi, Eventbrite, Pinterest, and AliExpress",,,English,EU,,"Trust & Safety, AI, content moderation, Digital Services Act, Online Safety Act, generative AI, compliance, harmful content",https://www.eu-startups.com/2025/04/tremau-secures-e3-million-to-scale-its-ai-powered-trust-safety-platform/,"April 4, 2025",
Unravel,6300000.0,London,UK,"AI, video commerce, travel",Series A,"AI-powered video commerce platform transforming travel discovery by turning creator-shot videos into seamless, AI-powered booking experiences.","Nauta Capital, Active Partners, Slingshot Ventures, Olivier Bisserier, Antler, Nodes, Upscalers, Brook Bay Capital, The Players Fund",2020,"decades of experience building AI products for banks, telcos, insurers and airlines","4x increase in daily active users, 10x increase in conversion on applications, partnerships with banks, insurers, and telecom operators across Asia and the Middle East",,Series A,English,UK,,"AI, video commerce, travel, booking, creators, TikTok, Instagram Reels, FinTech, telcos, airlines, banks",https://www.eu-startups.com/2025/04/tiktok-of-travel-unravel-raises-e6-3-million-to-innovate-travel-through-creator-driven-content/,"April 3, 2025",
Sedna Communications Ltd,10000000.0,London,UK,"workflow automation, global trade, supply chain",debt financing,AI-powered workflow automation platform focused on the global trade and supply chain market.,CIBC Innovation Banking,7,Robert Scott (CFO),"largest customer base for maritime communications, 200% increase in operator capacity, 80% productivity boost, acquisition of Nordic IT",,Debt Financing,English,UK,,"AI, workflow automation, supply chain, maritime, email management, productivity, growth financing",https://www.eu-startups.com/2025/04/sedna-communications-raises-e10-million-for-its-maritime-technology-platform/,"April 3, 2025",
Ultra,10800000.0,Tallinn,Estonia,"gaming, blockchain, technology",Funding round,"A one-stop destination for gamers, publishers, and developers aiming to transform the gaming industry.",NOIA Capital,2017,"Gus van Rijckevorsel (CEO), Maxime van Steenberghe (COO, former partner at Circle Strategies)","Appointment of new CEO and COO, strategic roadmap for 2025",,Funding round,English,EU,https://ultra.io/,"gaming, blockchain, technology, funding, Europe, digital assets",https://www.eu-startups.com/2025/04/levelling-up-ultra-secures-e10-8-million-to-redefine-gaming-in-europe-with-one-stop-destination/,"April 3, 2025",
Ecoat,21000000.0,Grasse,France,"sustainable binders, paint, coatings",Growth,"Ecoat develops water-based, bio-based, and high-performance binders that replace fossil-derived polymers in decorative, wood, and metal paints.","Yotta Capital, European Circular Bioeconomy Fund (ECBF), Starquest, ADEME, Bpifrance",13,"Olivier Choulet (CEO), Nadia Bouzigues (Managing Partner at Yotta Capital Partners), Michael Nettersheim (General Partner at ECBF), Chloé Cohen-Aknine (Investment Director at Starquest Capital)","60% average annual growth rate over the past 5 years, expanding production to 30,000 tons of bio-based binders, international expansion in Europe, US, and Asia",,Growth,English,EU,,"sustainable binders, paint, coatings, decarbonisation, bio-based, circular economy, green chemistry",https://www.eu-startups.com/2025/04/ecoat-secures-e21-million-to-reinvent-the-future-of-paint-sustainably/,"April 3, 2025",
Fairly Made,15000000.0,Paris,France,"sustainable fashion, SaaS",Series A,Fairly Made provides a turnkey solution to help fashion brands transition to more sustainable production by offering an assessment of the environmental impact of textile and leather products.,"BNP Paribas Solar Impulse Venture Fund, GET Fund, ETF Partners, Frenchfounders",6,visionary team,"100 million digital passports, over 100 brands, 80 employees, additional office in Milan",,Series A,English,EU,,"sustainable fashion, SaaS, supply chain transparency, ecodesign, environmental impact",https://www.eu-startups.com/2025/04/fairly-made-raises-e15-million-to-put-technology-at-the-service-of-responsible-fashion/,"April 3, 2025",
Lumai,9200000.0,Oxford,UK,"AI, optics, computing",Series A,"Lumai is an AI accelerator startup using optics to address global computational challenges, helping AI data centres reduce costs and boost performance while minimising energy consumption.","Constructor Capital, IP Group, PhotonVentures, Journey Ventures, LIFTT, Qubits Ventures, State Farm Ventures, TIS Inc",2022,"ex-University of Oxford, PhDs","advancing product development, doubling headcount, expanding U.S. presence, reportedly cutting AI inference costs to one-tenth of today's top solutions, delivering 50 times the performance of silicon-only accelerators while using just 10% of the power",,Series A,English,EU,,"AI, optics, computing, data centres, energy efficiency, photonics, scalability, performance, sustainability",https://www.eu-startups.com/2025/04/lumai-secures-more-than-e9-2-million-to-slash-ai-processing-costs-and-boost-performance/,"April 2, 2025",
Wealthyhood,3600000.0,London,United Kingdom,"FinTech, WealthTech, Digital Investing",Strategic,"Wealth-building app helping younger investors learn, save, invest and build wealth.",Global Wealth Group PLC,4,"Alexandros Christodoulakis, Co-founder & CEO","Over 50,000 active users in the UK, expansion into Greece and broader EU market, licensing from the Hellenic Capital Market Commission, B2B services launch",,Strategic,English,EU,,"FinTech, WealthTech, digital investing, financial independence, AI, automation, Europe, Greece, UK, B2B, Wealthyhood, Global Wealth Group",https://www.eu-startups.com/2025/04/fintech-startup-wealthyhood-lands-e3-6-million-investment-to-expand-to-greece/,"April 2, 2025",
CMR Surgical,185000000.0,Cambridge,UK,"Medical Devices, Surgical Robotics",Growth,"A global surgical robotics company dedicated to transforming surgery with their next-generation surgical robot, Versius.","Trinity Capital, Armentum Partners",2014,Experienced leadership including CEO Massimiliano Colella and CFO Andre Nel.,"Versius has been used in over 30,000 surgical cases globally, installed in more than 30 countries, and is the second most utilized soft tissue surgical robot in the world.",,Growth,English,UK,,"surgical robotics, Versius, medical devices, minimally invasive surgery, clinical trials, healthcare innovation",https://www.eu-startups.com/2025/04/more-than-just-a-robot-surgical-robotics-company-cmr-surgical-secures-over-e185-million/,"April 2, 2025",
Revaia,250000000.0,Paris,France,"growth investment, sustainable innovation, energy transition, AI, cybersecurity",Growth II,A leading independent European growth investor focusing on sustainable innovation and high-growth sectors like energy transition and AI.,"Bpifrance, European Investment Fund (EIF), BNP Paribas Cardif, JP MorganChase",2018,"Founding Partners Alice Albizzati and Elina Berrebi, with a team bringing hands-on expertise in go-to-market, AI, product, and ESG.","Fund I companies have grown 4x on average since investment, with 80% now generating between €40 million and over €250 million in revenues. Fund II is 40% deployed, with companies growing at an average rate of 70% per year.",600000000,Growth,English,EU,,"growth investor, sustainable innovation, energy transition, AI, cybersecurity, European tech leaders, capital efficiency, profitability",https://www.eu-startups.com/2025/04/growth-investor-revaia-closes-revaia-growth-ii-fund-at-e250-million/,"April 2, 2025",
Maps Untold,350000.0,Eindhoven,Netherlands,TravelTech,Seed,AI-powered personalised city guide platform delivering hyper-personalised travel recommendations.,"Rabobank, Leisure Ontwikkel Fonds",2021,"Dennis van Ravenstein, Gabriella Gomes Branco","Aims to exceed 250,000 monthly active users and generate at least €10k in monthly recurring revenue by year-end.",,Seed,English,EU,,"TravelTech, AI, personalised travel, sustainable travel, local economies",https://www.eu-startups.com/2025/04/tripadvisor-who-maps-untold-bags-e350k-to-personalise-your-next-adventure/,"April 1, 2025",
Fiberdom,3500000.0,Vantaa,Finland,"wood fibre material innovation, sustainable materials, packaging",,"Fiberdom is a Finnish materials innovation company that has created a 100% plastic-free, high-performance material from FSC-certified wood fibres.","Heino Group, Nordic Foodtech VC, Holdix Oy, Business Finland",2019,,"successfully commercialised its first application, single-use cutlery that complies with the EU’s Single-Use Plastics Directive, now available through leading Finnish retailers and B2B channels",,,English,EU,,"wood fibre, plastic-free, sustainable, packaging, innovation, materials, funding, Finland",https://www.eu-startups.com/2025/04/fiberdom-secures-e3-5-million-to-drive-plastic-free-circular-material-innovations/,"April 1, 2025",
ElevenLabs,281000000.0,,Europe,AI,,One of the fastest-scaling AI startups in Europe.,Carles Reina,,First investor and go-to-market strategist,Fastest-scaling AI startup in Europe,,,,,,"AI, go-to-market, SaaS, enterprise contracts, product-market fit, global scaling, cultural intelligence, brand, community, growth",https://www.eu-startups.com/2025/06/eu-startups-podcast-episode-123-carles-reina-investor-and-go-to-market-strategist-at-elevenlabs/,"June 26, 2025",
pyannoteAI,8100000.0,Paris,France,"Speaker Intelligence AI, speech technology, enterprise-grade speech applications",Seed,"pyannoteAI is pioneering Speaker Intelligence AI, transforming how AI processes and understands spoken language.","Crane Venture Partners, Serena, Julien Chaumond, Alexis Conneau",,"Hervé Bredin (former research scientist at CNRS), Vincent Molina","100,000+ developers worldwide, 45 million monthly downloads on HuggingFace",,Seed,English,EU,,"Speaker Intelligence AI, speech technology, enterprise-grade speech applications, open-source, HuggingFace, dubbing, synthetic voice creation",https://www.eu-startups.com/2025/04/pyannoteai-raises-e8-million-to-build-the-first-language-agnostic-speaker-intelligence-platform/,"April 7, 2025",
Different Dog,11700000.0,Shrewsbury,UK,"pet food, subscription service",,"A fresh dog food subscription service offering hand-cooked, human-grade meals tailored to dogs' dietary needs.",Charlie Oscar Group,2017,husband-and-wife duo Charlie & Alex Thurstan,"feeding over 18,000 dogs, employing over 100 people, five consecutive years of revenue doubling year-on-year",,,English,UK,,,https://www.eu-startups.com/2025/04/different-dog-raises-e11-million-for-its-hand-cooked-human-grade-dog-food/,"April 7, 2025",
Pennylane,75000000.0,Paris,France,"accounting, financial management, electronic invoicing",Unicorn,Pennylane is an accountancy platform that provides integrated financial management and electronic invoicing solutions for European businesses and accounting firms.,"Sequoia Capital, Capital G, Meritech, DST",4,CEO and Co-founder Arthur Waller,"4,500 accounting firms and 350,000 clients use the platform daily, tripled the number of SMEs on its platform in 12 months",Unicorn,Unicorn,English,EU,,"electronic invoicing, financial management, accounting, SMEs, digitisation, Europe",https://www.eu-startups.com/2025/04/unicorn-pennylane-bags-an-additional-e75-million-for-electronic-invoicing/,"April 7, 2025",
Grid Edge,3300000.0,Birmingham,UK,"AI, Energy Management, Sustainability",Funding round,AI-powered software that helps reduce carbon emissions and energy costs in commercial buildings.,"Midlands Engine Investment Fund II, Mercia Ventures, Centrica, bp Ventures, private investors",8,"Energy specialists (Jim Scott, Dan Wright, Tom Anderson), ex-Deloitte (Richard Moore), ex-EE and Amber Energy (Paul McCorquodale)","150% increase in ARR in the last year, plans to triple ARR again within two years, expanding from 120 to 400 locations, partnerships with Bull Ring shopping centre and Royal Opera House, clients include Amey, Equans, OCS",,,English,UK,,"AI, energy management, carbon emissions, sustainability, commercial buildings, Midlands Engine Investment Fund, Mercia Ventures, Centrica, bp Ventures",https://www.eu-startups.com/2025/04/grid-edge-raises-e3-3-million-for-ai-software-that-helps-cut-energy-costs-and-carbon/,"April 4, 2025",
Evolytes,1300000.0,Reykjavík,Iceland,"EdTech, Education",Seed,Elementary math learning platform that empowers students through game-based learning.,"Omega, Pekron Family Office, NSA Ventures",2017,Interdisciplinary research background,"160,000 students across 1,400 schools in the U.S., impact in Latin America, India, Middle East, South East Asia",,Seed,English,EU,,"math learning, EdTech, game-based learning, student engagement, education impact",https://www.eu-startups.com/2025/04/evolytes-raises-e1-3-million-to-scale-its-k-5-math-learning-platform-globally/,"April 4, 2025",
Sateliot,70000000.0,Barcelona,Spain,"SpaceTech, telecommunications, defense, cybersecurity, logistics, mining, energy, environment, agriculture, critical infrastructures",Series B,"Sateliot is pioneering the first LEO satellite constellation delivering NB-IoT connectivity, extending Mobile Telecom coverage to 100% of the planet.","Hyperion Fund, Sociedad Española de Transformación Tecnológica (SETT), Global Portfolio Investments, European Investment Bank (EIB), Indra, Cellnex, SEPIDES",0,"Jaume Sanpera, entrepreneur with 30+ years in technology and founder of eight companies; Marco Guadalupi, Co-founder and CTO, responsible for Eurona’s broadband satellite network deployment","Launched six satellites, €270 million in contracts with 400+ customers in 50 countries, aiming for €1 billion turnover by 2030",,Series B,English,EU,,"SpaceTech, 5G-IoT, satellite constellation, global connectivity, defense, cybersecurity, telecommunications, logistics, mining, energy, agriculture, critical infrastructures",https://www.eu-startups.com/2025/03/sateliots-space-leap-e70-million-to-connect-the-planet-with-5g-iot-from-orbit/,"March 26, 2025",
GravitHy,60000000.0,Marseille,France,"low-carbon iron, clean steel",Growth,"GravitHy is a low-carbon iron producer for the clean steel sector, aiming to accelerate the decarbonisation of the steel industry.","Japan Hydrogen Fund, Marcegaglia, Ecolab, Rio Tinto, Siemens, Engie New Ventures, InnoEnergy",2,"José Noldin (CEO), Diego Pavia (CEO of InnoEnergy)","Secured key contracts, completing engineering, obtaining permits, attracting top talent, plans to produce 2 million tons of DRI/HBI annually, creating up to 500 direct jobs",2200000000,Growth,English,EU,,"low-carbon iron, clean steel, decarbonisation, green steel, hydrogen, Direct Reduced Iron, Hot Briquetted Iron, industrial sovereignty",https://www.eu-startups.com/2025/03/producing-an-eiffel-tower-a-day-gravithy-secures-e60-million-to-power-green-steel-revolution/,"March 26, 2025",
Paid,10000000.0,London,UK,"AI, Business Platform",Pre-Seed,"Paid is a business platform for AI agents, providing margin intelligence and flexible pricing models to help AI agent companies accelerate growth and profitability.","EQT Ventures, Sequoia Capital",Founding year not mentioned,"Manny Medina, Co-founder of Outreach, scaled it to 6k customers, 800 employees, and €231 million in ARR","Early partners like Logic.app, 11x, and Vidlab7 report significant improvements in margin visibility after implementing Paid’s platform.",Not mentioned,Pre-Seed,English,UK,Not mentioned,"AI agents, business platform, monetisation, margin management, SaaS, EQT Ventures, Sequoia Capital",https://www.eu-startups.com/2025/03/paid-raises-e10-million-to-transform-ai-agent-economy-and-launch-beta-programme/,"March 25, 2025",Not mentioned
Incore Invest,25000000.0,Stockholm,Sweden,"SaaS, embedded finance, FinTech",Growth stage,"Investment firm focused on accelerating the growth of high-potential SaaS, embedded finance, and FinTech companies across Europe.",,2,"Nicolai Chamizo (CEO and Founder), Kasper Terrvik (Investment Manager, ex-Bloomberg, SEB Corporate Finance)","Launch of Incore Invest II, expanding portfolio, hiring of Kasper Terrvik",,Growth stage,English,EU,,"investment, SaaS, embedded finance, FinTech, Europe, growth stage, PSD2/3, open banking",https://www.eu-startups.com/2025/03/incore-invest-raises-e25-million-in-second-fund-to-accelerate-high-growth-investments-across-europe/,"March 25, 2025",
AMBOSS,240000000.0,Berlin,Germany,"Medical education, Clinical decision-making",Undisclosed,AMBOSS is a global medical knowledge platform changing the way medical know-how is acquired and utilised at the point of care.,"KIRKBI, M&G Investments, Lightrock, Partech",2012,"Physicians, scientists, software engineers","1 million professional users across 180 countries, acquired Novaheal and NEJM Knowledge+, every second inpatient treatment in Germany is reportedly carried out by a physician supported by AMBOSS, majority of medical students in the US use AMBOSS, 25% of first-year US residents depend on AMBOSS",,,English,EU,,"medical education, clinical decision-making, AI, technology, health care, international expansion, acquisitions",https://www.eu-startups.com/2025/03/amboss-raises-e240-million-to-expand-position-as-leading-co-pilot-for-physicians-worldwide/,"March 25, 2025",
n8n,55000000.0,Berlin,Germany,"AI workflow automation, business process automation",Series B,AI workflow automation platform for technical teams that combines AI capabilities with business process automation.,"Highland Europe, HV Capital, Sequoia, Felicis, Harpoon",2019,"Jan Oberhauser, Founder and CEO","200k active users, 5x ARR growth in the last year, 3k enterprises using the platform, partnerships with companies like Delivery Hero, Musixmatch, and Bordr",,Series B,English,EU,,"AI, workflow automation, business process automation, fair-code, LLM integrations, enterprise, community",https://www.eu-startups.com/2025/03/n8n-raises-e55-million-to-transform-workflow-automation-for-technical-teams/,"March 25, 2025",
Augustine Therapeutics NV,77700000.0,Leuven,Belgium,BioTech,Series A,"A BioTech company focused on developing new therapies for neuromuscular, neurodegenerative and cardio-metabolic diseases through the inhibition of the HDAC6 enzyme.","Novo Holdings, Jeito Capital, Asabys Partners, Eli Lilly and Company, AdBio partners, V-Bio Ventures, PMV, VIB, Gemma Frisius Fund, Charcot-Marie-Tooth (CMT) Research Foundation, Newton Biocapital",2019,"Prof. Ludo Van Den Bosch from the VIB-KU Leuven Centre for Brain and Disease Research, Gerhard Koenig, PhD","Advancing lead candidate into clinical trials for CMT, expanding activities in Denmark, two other programmes in discovery targeting peripherally-restricted and blood-brain barrier-penetrant HDAC6i",,Series A,English,EU,,"BioTech, HDAC6, neuromuscular, neurodegenerative, cardio-metabolic, clinical trials, CMT, medicinal chemistry",https://www.eu-startups.com/2025/03/augustine-therapeutics-raises-e78-million-to-develop-new-therapies-for-diseases-including-cmt/,"March 24, 2025",
